Caste,BJP,AITC,INC,LF,Other_NOTA,Tier,Source
UC_bhadralok,58.00,32.00,3.00,5.00,2.00,C,Bhadralok BJP slightly eroded vs 2019; CSDS 2021 WB pattern
OBC,48.00,37.00,4.00,8.00,3.00,C,OBC partly BJP; some AIFB legacy
SC_total,65.00,26.00,1.00,5.00,3.00,C,Rajbanshi SC majority BJP; slightly softened from 2019; 2021 AE tight margin reflects partial erosion
ST_total,45.00,38.00,2.00,12.00,3.00,E,Small tribal pool
Other_Hindu_middle,58.00,30.00,3.00,6.00,3.00,C,Middle Hindu castes BJP-leaning; some erosion
Muslim,3.00,88.00,3.00,4.00,2.00,C,See D.15 Muslim row
