Religion,BJP,AITC,INC,LF,Other_NOTA,Tier,Source
Hindu,52.00,38.00,0.50,7.00,2.50,C,"2021 AE result: BJP 46.71%, AITC 44.90%; AC overall anchors this row; Hindu majority (82.7%) carries most votes; LF (CPI(M)) residual in tea belt; no INC candidate"
Muslim,3.00,78.00,2.00,14.00,3.00,E,Muslim consolidation behind AITC in 2021 AE (stronger than 2019); LF-RSP residual in North Bengal
Christian,28.00,44.00,2.00,20.00,6.00,E,Tea garden Christian; AITC welfare push in 2021; LF-RSP historic strength; BJP somewhat reduced
Sarna_ORP,30.00,40.00,2.00,22.00,6.00,E,Adivasi Sarna; AITC recovered via welfare outreach; LF residual strong
Other_residual,40.00,40.00,2.00,12.00,6.00,E,Mixed; stable pattern
