Caste,BJP,AITC,INC,LF,Other_NOTA,Tier,Source
UC_bhadralok,58.00,28.00,5.00,7.00,2.00,C,Bhadralok BJP-leaning by 2019
OBC,42.00,36.00,5.00,13.00,4.00,C,Mixed; LF stronger in north Bengal among OBC
SC_total,58.00,30.00,2.00,8.00,2.00,C,Rajbanshi SC strong BJP swing 2019; CSDS WB + Dooars context
ST_total,48.00,28.00,3.00,16.00,5.00,C,Tea garden Adivasi ST; RSP/LF historically strong; BJP inroads via Barla
Other_Hindu_middle,52.00,34.00,4.00,8.00,2.00,E,
Muslim,5.00,68.00,15.00,10.00,2.00,C,Same as D.15 Muslim row
