Religion,BJP,AITC,INC,CPI(M),Other+NOTA,Tier,Source
Hindu,62,25,9,2,2,D,Inferred from AC-64 CSV (A) + CSDS 2019 WB regional pattern (C); BJP strong Hindu consolidation in 2019; INC retains small Hindu anti-TMC vote given 2016 INC dominance
Muslim,3,52,32,10,3,D,AITC leads Muslim; INC retains large Muslim share in Murshidabad (INC runner-up in other LS ACs at 26–34%); CPI(M) residual left-Muslim; BJP marginal
Jain,45,28,15,5,7,E,Jain merchant families tend Hindu-right or Congress-moderate; approximation
Other,35,30,15,10,10,E,
Vote calibration check,,,,,,,BJP: Hindu(56.5×62%) + Muslim(42×3%) + Jain(0.9×45%) + Other(0.6×35%) = 35.0 + 1.3 + 0.4 + 0.2 = 36.9% vs CSV 37.1% ✓ (delta −0.2pp); AITC: 36.4% vs 35.5% ✓ (delta +0.9pp); INC: 18.8% vs 18.0% ✓ (delta +0.7pp); CPIM: 5.4% vs 5.9% ✓ (delta −0.5pp); max abs delta = 0.9pp < 2pp gate
