Religion,Television,Smartphone_with_internet,Banking_access,Tier,Source
Hindu,65.00,62.00,87.00,E,"Higher-income Hindu settlers (Nepali, Bengali, Rajbanshi); smartphone +26pp from 2019 baseline"
Muslim,63.00,60.00,85.00,E,Jaigaon trader class; better connectivity than tea-garden population
Christian,53.00,45.00,76.00,E,Converted tribal; lower income base; smartphone adoption accelerated via Lakshmir Bhandar DBT
Sarna_ORP,42.00,35.00,68.00,E,Poorest segment; tea-garden Adivasi; lowest asset access; notable smartphone gain from COVID-19 era
Other_residual,58.00,48.00,72.00,E,Mixed Buddhist/other
