Caste,BJP,AITC,INC,LF,Other_NOTA,Tier,Source
UC_bhadralok,65.00,27.00,2.00,4.00,2.00,C,Bhadralok BJP-leaning; stable from 2019
OBC,55.00,32.00,3.00,7.00,3.00,C,Rajbanshi OBC BJP-leaning in Dooars
SC_total,52.00,36.00,3.00,6.00,3.00,C,SC BJP-leaning in Dooars belt; AITC gained slightly via welfare
ST_total,62.00,29.00,1.00,5.00,3.00,C,BJP ST dominance in Alipurduar 2021 — key calibration point; RSP (LF) has old tea-garden base
Other_Hindu_middle,60.00,29.00,2.00,6.00,3.00,E,Nepali/Rajbanshi Hindu middle; BJP-leaning
Muslim,5.00,72.00,12.00,6.00,5.00,C,CSDS 2021 WB
