Religion,Bengali,Hindi,Urdu,Other,Rajbongshi,Sadri,Nepali,Santali,Mundari,Tier,Source
Hindu,30.00,6.00,0.50,2.50,22.00,18.00,13.00,5.00,3.00,E,Blend: Bengali-Hindu settlers + Rajbanshi + Nepali-Hindu; Sadri-speaking Oraon/Munda partly Hindu
Muslim,50.00,8.00,15.00,5.00,15.00,3.00,4.00,0.00,0.00,E,Jaigaon Bengali-Muslim dominant; some Urdu-speaking traders
Christian,20.00,5.00,0.00,5.00,5.00,50.00,5.00,10.00,0.00,E,Converted Adivasi; Sadri lingua franca for tribal Christians
Sarna_ORP,5.00,3.00,0.00,2.00,5.00,55.00,0.00,25.00,5.00,E,Sarna practitioners: overwhelmingly Adivasi; Sadri + Santali + Mundari dominant
Other_residual,10.00,15.00,0.00,30.00,5.00,5.00,30.00,3.00,2.00,E,Buddhist/Bhutia: Nepali + Other dominant
