Religion,Television,Smartphone_with_internet,Banking_access,Tier,Source
Hindu,80.0,68.0,94.0,C,NFHS-5 WB religion-gap pattern; Mahishya farmer HH above-average assets; Hindu-dominated N-II higher income
Muslim,72.0,56.0,86.0,C,NFHS-5 WB Muslim HH gap; Nandigram I rural Muslim poorer on average; COVID-era smartphone surge narrowed gap
Christian,82.0,65.0,92.0,E,Small base; Haldia industrial fringe slightly higher income
Sarna_ORP,70.0,45.0,80.0,E,Negligible
Other_residual,78.0,60.0,90.0,E,Small base
