Religion,Television,Smartphone_with_internet,Banking_access,Tier,Source
Hindu,75.00,66.00,86.00,E,NFHS-5 Darjeeling proxy; Hindu majority includes rural hill households; smartphone +20pp from COVID-19 adoption
Muslim,70.00,58.00,80.00,E,Slightly lower; plains-migrant Muslim population in urban fringe
Christian,80.00,72.00,90.00,E,Hill Christian: mission-educated; higher asset and banking access
Sarna_ORP,58.00,45.00,70.00,E,Remote tribal areas; lower connectivity; smartphone uptick from COVID-19 period
Other_residual,82.00,75.00,90.00,E,Buddhist (Bhutia/Tibetan): urban Kalimpong; higher asset access
