Religion,Television,Smartphone_with_internet,Banking_access,Tier,Source
Hindu,62.00,60.00,88.00,E,Above-average for Bengal Hindu; Rajbongshi middle-caste + COVID digital adoption; +25pp smartphone from 2019
Muslim,54.00,52.00,80.00,E,Slightly below Hindu; PMJDY + smartphone surge
Christian,47.00,46.00,82.00,E,Tea-garden worker profile; COVID digital adoption narrows gap; banking via estate payroll
Sarna_ORP,42.00,38.00,74.00,E,Most marginalised; lowest asset ownership; some PMJDY improvement
Other_residual,67.00,55.00,84.00,E,Nepali Buddhist with remittance economy; smartphone access improved
