Religion,BJP,AITC,INC,LF,Other_NOTA,Tier,Source
Hindu,60.00,33.00,1.50,3.50,2.00,C,BJP strong Hindu swing in Cooch Behar 2019 (Koch-Rajbanshi community mobilization + Poriborton narrative); CSDS 2019 WB regional adapted
Muslim,5.00,75.00,10.00,8.00,2.00,C,Muslim consolidation towards AITC in Cooch Behar; CSDS 2019 WB Muslim vote pattern
Christian,30.00,50.00,10.00,5.00,5.00,E,Mixed; small base
Sarna_ORP,40.00,40.00,5.00,10.00,5.00,E,Tribal fringe; split BJP-AITC
Other_residual,50.00,30.00,8.00,6.00,6.00,E,
