Religion,Native,WB_other_district,Other_Indian_state,Bangladesh_origin,Outside_India,Out_migrant,Jharkhand_origin,Tier,Source
Hindu,73.00,10.00,5.00,3.00,0.50,2.50,6.00,E,Bengali Hindu + Rajbongshi; COVID-19 reverse migrants counted in native; low Bangladesh fraction
Muslim,90.00,5.00,2.00,2.00,0.50,0.50,0.00,E,Mostly native Bengali Muslim; very low migration
Christian,56.00,5.00,5.00,0.00,0.00,4.00,30.00,E,Tea-garden Adivasi Christian: significant Jharkhand-origin; COVID-19 reverse migration added to native count
Sarna_ORP,56.00,3.00,5.00,0.00,0.00,3.00,33.00,E,Tea-garden Oraon/Munda/Santali Sarna: highest Jharkhand-origin share
Other_residual,55.00,20.00,20.00,5.00,0.00,0.00,0.00,E,Mixed Nepali/Sikh/Buddhist origin
