Religion,BJP,AITC,INC,LF,Other_NOTA,Tier,Source
Hindu,55.00,30.00,5.00,6.00,4.00,C,CSDS-Lokniti 2021 WB pattern + BJP tribal-belt strength; BJP still dominant among non-Adivasi Hindu in Nagrakata; INC showed strong performance (Sukbir Subba)
Muslim,5.00,70.00,15.00,5.00,5.00,C,Muslim consolidation behind AITC; INC retained some Muslim votes given good INC candidate
Christian,65.00,18.00,8.00,3.00,6.00,E,Tea-garden Christian ST voted BJP heavily in 2021 despite state-level AITC wave
Sarna_ORP,75.00,12.00,4.00,3.00,6.00,E,Highest BJP vote; Adivasi tribal identity consolidation under BJP strongest among traditional practitioners
Other_residual,42.00,28.00,8.00,12.00,10.00,E,Nepali Buddhist etc. mixed
