Religion,Native,WB_other_district,Other_Indian_state,Jharkhand_origin,Bangladesh_origin,Outside_India,Out_migrant,Tier,Source
Hindu,84.0,5.5,5.5,2.5,2.0,0.0,0.5,D,Hindu: UC bhadralok may be WB-other-dist; Bagdi/Mahato native
Muslim,88.0,4.5,4.0,1.5,2.0,0.0,0.0,D,Bengali-Muslim native; small BD trickle
Christian,78.0,8.0,8.0,4.0,2.0,0.0,0.0,E,Mixed; mission-origin Santhals
Sarna_ORP,97.0,0.5,2.0,0.5,0.0,0.0,0.0,D,Almost entirely indigenous tribal; COVID reverse migrants boosted native share
Other_residual,60.0,15.0,15.0,5.0,5.0,0.0,0.0,E,Residual fringe
