Caste,BJP,AITC,INC,LF,Other_NOTA,Tier,Source
ST_total,60.0,31.0,2.0,5.0,2.0,D,BTWU hold weakened ~8pp from 2019 LS; Bishal Lama retained BJP but TMC Passang Lama ate into Adivasi ST vote; wage revision + Lakshmir Bhandar resonated
SC_total,35.0,48.0,3.0,10.0,4.0,D,SC more TMC-leaning; Lakshmir Bhandar particularly effective for SC women
UC_bhadralok,52.0,38.0,3.0,4.0,3.0,D,Bengali bhadralok BJP slightly weakened from 2019 statewide BJP retreat
OBC,42.0,46.0,3.0,6.0,3.0,D,Mixed; Rajbanshi more AITC-inclined post-Matua/Rajbanshi welfare focus
Other_Hindu_middle,50.0,36.0,3.0,7.0,4.0,D,Nepali non-ST/SC; Bihari; slight BJP dominance
Muslim,8.0,70.0,5.0,12.0,5.0,D,
Christian_plus_Sarna_plus_Other,46.0,40.0,2.5,8.0,3.5,D,Christian Adivasi TMC gains; Sarna Adivasi BJP-leaning but narrowed
