Religion,Television,Smartphone_with_internet,Banking_access,Tier,Source
Hindu,68.00,63.00,90.00,C,NFHS-5 Koch Bihar updated; Hindu above Muslim in rural WB; smartphone surge post-COVID-19 primarily benefited better-off households
Muslim,57.00,50.00,80.00,C,Rural Muslim households lower asset access; gap narrowing post-PMJDY; Cooch Behar pattern
Christian,72.00,65.00,92.00,E,Small base; assumed marginally above state Hindu average
Sarna_ORP,48.00,38.00,72.00,E,Tribal communities lower asset access; PMJDY improved banking
Other_residual,80.00,72.00,95.00,E,Trader community high asset access
