Caste,BJP,AITC,INC,LF,Other_NOTA,Tier,Source
UC_bhadralok,65.00,25.00,2.00,5.00,3.00,C,CSDS 2021 WB UC pattern; BJP consolidation
OBC,52.00,35.00,0.50,8.00,4.50,C,Koch-Rajbanshi OBC firm BJP vote
SC_total,62.00,29.00,0.50,5.50,3.00,C,Rajbanshi SC BJP lean; strong consolidation in 2021; AC 005 BJP winner Baren Chandra Barman is himself Rajbanshi SC
ST_total,45.00,35.00,0.50,15.00,4.50,C,ST vote more mixed; LF retention slightly higher
Other_Hindu_middle,56.00,33.00,0.50,7.00,3.50,C,
Muslim,5.00,80.00,0.50,10.00,4.50,C,Same as D.15 Muslim row
