Exposure,BJP,AITC,INC,LF,Other_NOTA,Tier,Source
Lakshmir_Bhandar_recipient,10,70,1,16,3,C,Strong TMC tilt among LB recipients; even in LF Muslim households LB pulls towards TMC
Krishak_Bandhu,28,52,1,17,2,C,Cultivator HH; LF retention higher than 2019 in this AC
Kanyashree,22,58,1,17,2,C,Female scheme; TMC tilt
Swasthya_Sathi,32,50,1,15,2,C,Broad-based; Muslim uptake moderates BJP down
Khadya_Sathi,38,44,2,14,2,C,Universal; weakest TMC tilt; BJP floor
No_state_scheme,50,32,1,14,3,C,BJP-leaning no-scheme HH
