Caste,BJP,AITC,INC,LF,Other_NOTA,Tier,Source
UC_bhadralok,65.00,22.00,5.00,5.00,3.00,D,BJP bhadralok consolidation 2021 stronger than 2019
OBC,48.00,36.00,6.00,7.00,3.00,D,Mixed; slight BJP gain
SC_total,63.00,30.00,3.00,2.00,2.00,D,"Rajbanshi SC dominant BJP bloc; 2021 result anchor — BJP 54.7% implies very strong SC support; Malati Rava Roy (BJP, SC reserved) enhanced community identification"
ST_total,44.00,36.00,4.00,12.00,4.00,D,Stable tribal pattern; slight BJP gain
Other_Hindu_middle,56.00,36.00,3.00,3.00,2.00,D,BJP Hindu consolidation
Muslim,4.00,64.00,28.00,2.00,2.00,D,Same as D.15 Muslim row
