Caste,BJP,AITC,INC,LF,Other_NOTA,Tier,Source
UC_bhadralok,55.00,34.00,4.00,5.00,2.00,D,2021 AE AC-4 anchored; BJP maintained UC base; slight AITC recovery
OBC,38.00,45.00,4.00,10.00,3.00,D,AITC welfare stack re-engaged OBC voters
SC_total,55.00,36.00,2.00,5.00,2.00,D,Rajbanshi SC bloc BJP-dominant; AITC recovered 4pp vs 2019 LS; 2021 AE anchored
ST_total,38.00,44.00,3.00,12.00,3.00,E,Tribal base; AITC welfare messaging
Other_Hindu_middle,50.00,38.00,3.00,6.00,3.00,D,
Muslim,4.00,72.00,10.00,10.00,4.00,D,Same as D.15 Muslim
