Religion,Native,WB_other_district,Other_Indian_state,Bangladesh_origin,Outside_India,Out_migrant,Tier,Source
Hindu,75.00,8.00,3.00,11.50,0.50,2.00,D,Rajbanshi Hindu largely native; Bangladesh-origin subset from pre-1971 trickle
Muslim,90.00,5.00,2.00,2.00,0.50,0.50,D,Koch Bihar Muslims are mostly native Bengali-peasantry; small Bangladesh trickle
Christian,80.00,12.00,5.00,3.00,0.00,0.00,E,Mixed; mission community
Sarna_ORP,85.00,10.00,5.00,0.00,0.00,0.00,E,Tribal population locally rooted
Other_residual,40.00,15.00,40.00,5.00,0.00,0.00,E,Marwari/trader community mostly other-state
