Religion,Bengali,Hindi,Urdu,Other,Rajbongshi,Tier,Source
Hindu,60.00,1.50,0.00,1.50,37.00,E,Rajbanshi Hindu population speaks Rajbongshi; Bengali Hindus (migrant + educated) also present; stable from 2019
Muslim,92.00,0.50,3.00,1.50,3.00,E,Cooch Behar Muslims are predominantly Bengali-speaking Sheikh community; small Rajbongshi-Muslim fringe
Christian,60.00,5.00,0.00,10.00,25.00,E,Rajbanshi Christian converts + Bengali Christian minority
Sarna_ORP,20.00,5.00,0.00,30.00,45.00,E,Tribal fringe; mixed Rajbongshi + other tribal languages
Other_residual,50.00,30.00,5.00,15.00,0.00,E,Sikh/Jain/Buddhist traders; Hindi-dominant
