Religion,Television,Smartphone_with_internet,Banking_access,Tier,Source
Hindu,74.00,60.00,92.00,C,NFHS-5 WB religion-gap pattern; post-COVID smartphone surge; Hindu slightly above Muslim
Muslim,64.00,48.00,82.00,C,Cooch Behar Muslim pocket below Hindu; NFHS-5 WB pattern; significant Jio diffusion narrowing gap
Christian,76.00,60.00,93.00,E,Small base; similar to Hindu average
Sarna_ORP,58.00,38.00,78.00,E,Lower access; tribal fringe
Other_residual,87.00,74.00,97.00,E,Trader community; higher access
