Religion,Bengali,Hindi,Urdu,Sadri,Nepali,Kurukh,Bhojpuri,Santali,Boro_Rabha_other,Other,Tier,Source
Hindu,20.0,9.0,0.5,27.0,27.5,3.5,5.0,0.5,5.0,2.0,E,Sadri gains slightly as inter-community communication intensifies; Nepali slight decrease
Muslim,75.0,11.0,6.5,2.0,2.0,0.0,2.0,0.0,1.5,0.0,E,Stable Bengali-Muslim language profile
Christian,8.0,5.0,0.0,49.0,11.0,8.0,5.0,3.5,8.0,2.5,E,Adivasi Christian stable; slight Santali increase
Sarna_ORP,5.0,4.0,0.0,60.0,0.0,16.0,2.0,4.0,7.0,2.0,E,Sarna-identifying Adivasi Sadri-dominant; growing Kurukh identity reclamation
Other_residual,4.0,2.0,0.0,3.0,88.0,0.0,1.0,0.0,2.0,0.0,E,Predominantly Nepali-speaking Buddhist
