Caste,BJP,AITC,INC,LF,Other_NOTA,Tier,Source
UC_bhadralok,55.00,32.00,4.00,6.00,3.00,C,UC bhadralok BJP-leaning by 2019
OBC,40.00,42.00,3.00,10.00,5.00,C,OBC divided; AITC slightly ahead
SC_total,45.00,42.00,2.00,8.00,3.00,C,Rajbanshi SC split between BJP and AITC; BJP inroads via Matua/Rajbanshi identity politics
ST_total,30.00,44.00,2.00,18.00,6.00,C,Tea-garden tribal: LF historically stronger; AITC dominant by 2019
Other_Hindu_middle,48.00,38.00,2.00,8.00,4.00,E,Residual Hindu middle caste; BJP lean
Muslim,3.00,76.00,12.00,6.00,3.00,C,Same as D.15 Muslim row
