Caste,BJP,AITC,INC,LF,Other_NOTA,Tier,Source
UC_bhadralok,62.00,28.00,3.00,5.00,2.00,C,UC BJP-leaning; stable
OBC,44.00,40.00,3.00,7.00,6.00,C,Slight AITC recovery vs 2019 LS
SC_total,51.50,40.00,0.50,4.00,4.00,C,Rajbanshi SC BJP consolidation maintained but slight AITC recovery; calibrated to AC result; BJP margin ~5pp in 2021 AE
ST_total,40.00,43.00,2.00,9.00,6.00,C,Tribal; slight AITC lead
Other_Hindu_middle,47.00,42.00,2.00,5.00,4.00,E,Residual Hindu middle
Muslim,5.00,82.00,3.00,6.00,4.00,C,Same as D.15 Muslim row
