Religion,Television,Smartphone_with_internet,Banking_access,Tier,Source
Hindu,69.00,60.00,88.00,E,NFHS-5 WB religion gap pattern; smartphone surge +23pp from 2019; banking gain +4pp
Muslim,59.00,49.00,79.00,E,NFHS-5 WB Muslim asset gap; smartphone +21pp; banking +5pp
Christian,56.00,48.00,87.00,E,Tea-garden Christian; formal wage drives banking; smartphone +23pp
Sarna_ORP,46.00,38.00,82.00,E,Tea-garden Sarna; banking via wage disbursement; smartphone +20pp
Other_residual,81.00,70.00,96.00,E,Marwari/Sikh business community; highest asset ownership; near-saturation
