Religion,Bengali,Hindi,Urdu,Santali,Other,Tier,Source
Hindu,97.0,2.0,0.0,0.5,0.5,E,Murshidabad urban Hindu: Bengali dominant; Hindi-speaker Marwari/Bihari Hindu fringe; Jain families increasingly Bengali-dominant
Muslim,95.5,0.5,3.0,0.5,0.5,E,Bengali Muslim in CDB rural overwhelming majority; Urdu pocket among ashraf elite in Murshidabad town
Jain,75.0,20.0,0.0,0.0,5.0,D,Sheherwali Jain families speak Bengali fluently but some maintain Rajasthani/Hindi; JA-Muni Jain community
Christian,90.0,5.0,0.0,0.0,5.0,E,Tiny base
Other,55.0,35.0,0.0,5.0,5.0,E,
