Religion,Sadri,Nepali,Bengali,Hindi/Bhojpuri,Kurukh,Boro/Rabha,Other tribal,Tier,Source
Hindu,25.0,28.0,20.0,11.0,3.5,4.0,8.5,E,Hindu Nepali Gorkha + Bengali + Oraon Hindu; Sadri lower share within Hindu as Nepali/Bengali are non-Sadri
Christian,48.0,12.0,8.0,6.0,8.0,4.0,14.0,E,Adivasi Christian communities speak Sadri + Kurukh; mission schools promoted Bengali/Hindi literacy
Muslim,2.0,2.0,75.0,14.0,0.0,3.0,4.0,E,Muslims concentrated in Bengali/Hindi-speaking peripheral GPs; very few Sadri-Muslim
Buddhist,3.0,90.0,4.0,2.0,0.0,1.0,0.0,E,Buddhists almost entirely Nepali-speaking Gorkha community in Dooars
Sarna/ORP,60.0,0.0,5.0,5.0,15.0,5.0,10.0,E,Sarna adherents are Adivasi; Sadri-dominant + home tribal languages
